{
  "$schema": "https://json-schema.org/draft/2020-12/schema",
  "$id": "netra://schemas/inventory/v1",
  "title": "NETRA Inventory Record",
  "type": "object",
  "additionalProperties": false,
  "required": [
    "sku",
    "shelf_id",
    "tare_weight_grams",
    "unit_weight_grams",
    "current_weight_grams",
    "estimated_quantity",
    "threshold",
    "status",
    "last_updated",
    "confidence"
  ],
  "properties": {
    "sku": {
      "type": "string",
      "minLength": 1
    },
    "shelf_id": {
      "type": "string",
      "minLength": 1
    },
    "tare_weight_grams": {
      "type": "number",
      "minimum": 0
    },
    "unit_weight_grams": {
      "type": "number",
      "exclusiveMinimum": 0
    },
    "current_weight_grams": {
      "type": "number",
      "minimum": 0
    },
    "estimated_quantity": {
      "type": "integer",
      "minimum": 0
    },
    "threshold": {
      "type": "integer",
      "minimum": 0
    },
    "last_updated": {
      "type": "string",
      "format": "date-time"
    },
    "confidence": {
      "type": "number",
      "minimum": 0,
      "maximum": 1
    },
    "status": {
      "type": "string",
      "enum": [
        "NORMAL",
        "LOW",
        "OUT_OF_STOCK",
        "UNCERTAIN"
      ]
    }
  }
}